[
  {
    "id": "11111111-1111-4111-8111-111111111111",
    "name": "Profile 001",
    "group": "QA demo",
    "proxy_mode": "required",
    "proxy_id": "44444444-4444-4444-8444-444444444444",
    "config_revision": 1,
    "preset": {
      "viewport": {
        "width": 1024,
        "height": 768
      },
      "locale": "vi-VN",
      "timezone_id": "Asia/Ho_Chi_Minh",
      "color_scheme": "light",
      "user_agent_mode": "engine_default"
    },
    "start_url": "https://fixture.example/start"
  },
  {
    "id": "22222222-2222-4222-8222-222222222222",
    "name": "Profile 002",
    "group": "QA demo",
    "proxy_mode": "required",
    "proxy_id": "55555555-5555-4555-8555-555555555555",
    "config_revision": 1,
    "preset": {
      "viewport": {
        "width": 1024,
        "height": 768
      },
      "locale": "vi-VN",
      "timezone_id": "Asia/Ho_Chi_Minh",
      "color_scheme": "light",
      "user_agent_mode": "engine_default"
    },
    "start_url": "https://fixture.example/start"
  },
  {
    "id": "33333333-3333-4333-8333-333333333333",
    "name": "Profile 003",
    "group": "QA demo",
    "proxy_mode": "required",
    "proxy_id": "66666666-6666-4666-8666-666666666666",
    "config_revision": 1,
    "preset": {
      "viewport": {
        "width": 1024,
        "height": 768
      },
      "locale": "vi-VN",
      "timezone_id": "Asia/Ho_Chi_Minh",
      "color_scheme": "light",
      "user_agent_mode": "engine_default"
    },
    "start_url": "https://fixture.example/start"
  }
]
